{
  "artifacts": [
    {
      "description": "EcoCheck field fact candidate payload contract.",
      "kind": "schema",
      "path": "schemas/semantic_event.v2.schema.json",
      "sha256": "d4d0bda9d608baa69970df1260446f00c9e26884c7d773d77a5ec847f5e4f737"
    },
    {
      "description": "EcoCheck company-profile gap confirmation contract.",
      "kind": "schema",
      "path": "schemas/profile_gap_confirmed.v1.schema.json",
      "sha256": "1a1a3901fb22b8121d7b88b3c9d75633598275a2559b62c77146bae1d756f383"
    },
    {
      "description": "KB graph package product manifest contract.",
      "kind": "schema",
      "path": "schemas/kb_product_manifest.v1.schema.json",
      "sha256": "d13cabd36eb1c7a1c47f96b52e68f6992fcf214a346e4a36872e83de7a5218b3"
    },
    {
      "description": "Shared ontology registry shape.",
      "kind": "schema",
      "path": "schemas/ontology_registry.v1.schema.json",
      "sha256": "c0a97784d8f51243468e40f4268caa0f308bcf77e1491aded54a517044c0aba2"
    },
    {
      "description": "Ontology v0.1.0 release manifest shape.",
      "kind": "schema",
      "path": "schemas/release_manifest.v1.schema.json",
      "sha256": "b615edc74b7723be6ded5dba0a92e3fcaac6827c58d130527268e146a3cb60c1"
    },
    {
      "description": "Consumer compatibility matrix shape.",
      "kind": "schema",
      "path": "schemas/consumer_compatibility_matrix.v1.schema.json",
      "sha256": "23c8253f29efaa79b9372ebdcb5981b92ada507fd9aa1d3045c9f20bb31c30cb"
    },
    {
      "description": "EcoCheck projection artifact shape.",
      "kind": "schema",
      "path": "schemas/projections.ecocheck.v1.schema.json",
      "sha256": "5b5ded607115036a3ba01b89296df0701475d6b5335c4b7ce827200d174caf68"
    },
    {
      "description": "Graph and KB registry projection artifact shape.",
      "kind": "schema",
      "path": "schemas/projections.registry.v1.schema.json",
      "sha256": "f717b5812b4a5deb57690cef35930ece78cae3cb3bbaa1d7f1cc069a5ebdb06d"
    },
    {
      "description": "Graph and KB schema fragment projection artifact shape.",
      "kind": "schema",
      "path": "schemas/projections.schema_fragment.v1.schema.json",
      "sha256": "22f48373d881dfe060ca24e5d1ddc57dbac43ee167bbbeff7aa192b3e4624a2e"
    },
    {
      "description": "Projection artifact manifest shape.",
      "kind": "schema",
      "path": "schemas/projections.manifest.v1.schema.json",
      "sha256": "ad22c3736be74735bbb4f25b2ba385f5b833de86b569a18c09272bd67ed01767"
    },
    {
      "description": "Declarative projection generator contract shape.",
      "kind": "schema",
      "path": "schemas/projection_spec.v1.schema.json",
      "sha256": "0d3a044229f37e82831d04ed5a0ba22b2e10ebfeef1675cd15c8803b7b8f9e4d"
    },
    {
      "description": "Consumer adoption receipt evidence shape.",
      "kind": "schema",
      "path": "schemas/consumer_adoption_receipt.v1.schema.json",
      "sha256": "1acd9146ff707cdfcd469417d9a81470d714d7eeaa9fb3f77551058e39dbd107"
    },
    {
      "description": "Projection sidecar provenance evidence shape.",
      "kind": "schema",
      "path": "schemas/projection_provenance.v1.schema.json",
      "sha256": "d7ff5943902f5669171c62db6bcd18b049e429a6932e47b8d92c1184dda2d3fb"
    },
    {
      "description": "S01-S13 environmental risk-domain registry.",
      "kind": "registry",
      "path": "registries/risk_domains.v1.json",
      "sha256": "766485ce94a36290d8a46800c700fa42b6383f503e175b06b0f1a1cc6e78bb0c"
    },
    {
      "description": "Shared issue-type registry.",
      "kind": "registry",
      "path": "registries/issue_types.v1.json",
      "sha256": "4603c6abfd2c29f5eae970ec039ec532174ce6ffae85d65a84c86810754654d1"
    },
    {
      "description": "Shared observed-signal registry.",
      "kind": "registry",
      "path": "registries/observed_signals.v1.json",
      "sha256": "86fc1aa045c758df44d1675ff6f2a3e4d72040d94d57fd8454cd5c1b8b59590d"
    },
    {
      "description": "Shared entity-anchor registry.",
      "kind": "registry",
      "path": "registries/entity_anchors.v1.json",
      "sha256": "d3c81a1ef9217514cb938f3eb6b6caf05abce1eaf9ef24c3b2a476c3b1975d3d"
    },
    {
      "description": "Legal-basis reference class registry without full legal text.",
      "kind": "registry",
      "path": "registries/legal_basis_ref.v1.json",
      "sha256": "3ba958736be66b9d9ed917dbf9144d22efccc63bcf90b5887c80e39f0e699457"
    },
    {
      "description": "Three-consumer compatibility matrix for v0.1.0.",
      "kind": "contract",
      "path": "contracts/consumer-compatibility-matrix.v1.json",
      "sha256": "2e699a7a4484403cf3468e0ae2ca969fc2b1dbfcdc9a03347af9e36ebc16e508"
    },
    {
      "description": "Declarative source-to-projection specification for v0.1.0.",
      "kind": "contract",
      "path": "contracts/projection-spec.v1.json",
      "sha256": "6a366864fbb2dc207955a0eb815f06529726bedc50fb89b899f101e5bd62c946"
    },
    {
      "description": "P3 baseline freeze retained as release input evidence.",
      "kind": "contract",
      "path": "contracts/p3-baseline.v0.json",
      "sha256": "d80dae4ec42ab5111b863f8fea35791109750950674350c7e12d45194c7a93de"
    },
    {
      "description": "EcoCheck JSON projection.",
      "kind": "projection",
      "path": "dist/projections/ecocheck/ontology-contracts.generated.json",
      "sha256": "11b6d9e6becbdd45540bc998b6c74270ab9a678377b1ecd92b4c9aa81082f457"
    },
    {
      "description": "Graph registry projection.",
      "kind": "projection",
      "path": "dist/projections/graph/ontology-registry.generated.json",
      "sha256": "18846a7375b54b034c8512a5e71de6222fd8db086b2b031594ba87b0ad173479"
    },
    {
      "description": "Graph schema fragment projection.",
      "kind": "projection",
      "path": "dist/projections/graph/schema.fragment.generated.json",
      "sha256": "f2720412066da1d80ff3eeadcdb070863338f7053a01a23719b3fa714bb81ea6"
    },
    {
      "description": "KB registry projection.",
      "kind": "projection",
      "path": "dist/projections/kb/ontology-registry.generated.json",
      "sha256": "77312a8f0602092cae83d175d2fe91e388ab86721455bb37a543868f56c9878a"
    },
    {
      "description": "KB schema fragment projection.",
      "kind": "projection",
      "path": "dist/projections/kb/schema.fragment.generated.json",
      "sha256": "99ac8d0ce129b0f06cd2c5189d30da500389a16ce5889746273df7e48550a5bc"
    },
    {
      "description": "Projection artifact manifest.",
      "kind": "projection",
      "path": "dist/projections/projection-manifest.v1.json",
      "sha256": "f2a4b355b9f5cd65bf1698d893a3e97476a87522d14080e90b548f6df2bd4dba"
    },
    {
      "description": "Boundary and blocking cutover ADR for v0.1.0.",
      "kind": "documentation",
      "path": "docs/adr/0003-eco-ontology-v0-1-0-versioned-contract-package.md",
      "sha256": "872b492db53c74f17f9d6d07849e69e0585548d9bde57924cd7bc1498454c26f"
    },
    {
      "description": "Projection artifact shape and validation bucket ADR.",
      "kind": "documentation",
      "path": "docs/adr/0005-projection-governance-middle-layer.md",
      "sha256": "0bf1ca9ccbc3581233bc4f233bebb17104db67b10237c29b97c4945896451c21"
    },
    {
      "description": "Consumer adoption receipt interface.",
      "kind": "documentation",
      "path": "docs/api/consumer-adoption-receipts.md",
      "sha256": "d46380fff9c4a4a380d01dff1e10d3a6eed210502b3b78d0bd8dbb88e1d692b0"
    },
    {
      "description": "Declarative projection specification interface.",
      "kind": "documentation",
      "path": "docs/api/projection-spec.md",
      "sha256": "53caa420bb40807ed4d0b2bc685570fdc9ff986c23d8d14657ccd681572173f1"
    },
    {
      "description": "Release bundle manifest interface.",
      "kind": "documentation",
      "path": "docs/api/release-bundle.md",
      "sha256": "6dbc7a92d2fdeb880e7c3c7b30d3f71a3b9c47740839148122a1a7110c194f14"
    },
    {
      "description": "Projection provenance sidecar interface.",
      "kind": "documentation",
      "path": "docs/api/projection-provenance.md",
      "sha256": "b766886f464fd7cf78883ebb2918651fb66bb9ecf70248d98cd16c230ce9ebb3"
    },
    {
      "description": "Projection golden and negative fixture plan.",
      "kind": "documentation",
      "path": "docs/validation/projection-test-plan.md",
      "sha256": "c00101b999dc3404f7e24b853c906ad63bd5b07afb8bbd4e5b111a4a077a7d7c"
    },
    {
      "description": "Release bundle verification checklist.",
      "kind": "documentation",
      "path": "docs/validation/release-bundle-checklist.md",
      "sha256": "a5d104da128b0b2d5402f1fba4a217b45a3e7515378c06e563fcc9be5abf2e6f"
    }
  ],
  "consumer_snapshots": [
    {
      "branch": "main",
      "commit": "a2983d61c0ede6ff0506c3f1a900e67ff205f358",
      "contracts": [
        "ecocheck.semantic_event.v2",
        "ecocheck.profile_gap_confirmed.v1",
        "eco-ontology.registry.v1"
      ],
      "notes": "EcoCheck keeps scoring and field workflow ownership. Ontology only supplies schema and registry projection ids.",
      "projection_artifacts": [
        {
          "path": "dist/projections/ecocheck/ontology-contracts.generated.json",
          "sha256": "11b6d9e6becbdd45540bc998b6c74270ab9a678377b1ecd92b4c9aa81082f457"
        }
      ],
      "repo": "EcoCheck",
      "validation_mode": "mixed"
    },
    {
      "branch": "main",
      "commit": "52932f051d714103281944753c9a2a4276bbb5bd",
      "contracts": [
        "ecocheck.semantic_event.v2",
        "ecocheck.profile_gap_confirmed.v1",
        "kb.product_manifest.v1",
        "eco-ontology.registry.v1"
      ],
      "notes": "Graph keeps topology, tiering, review, and export ownership. Ontology supplies ids, schema refs, and hash evidence.",
      "projection_artifacts": [
        {
          "path": "dist/projections/graph/ontology-registry.generated.json",